score,selftext,id,over_18,subreddit,title,created_utc,author,condition,is_arabic
1,"انا معتقدش ان عندي مشاكل نفسية الحمد لله، ولكن برده احيانا مش بقدر افهم حاجة بتتقال قدامي ودا مجرد شيء طبيعي، مجالات خبراتنا بتختلف، شوف اتنين دكاترة بيقلشو سوا وهتقول عُبط...ونفس الموضوع بالعكس ممكن اقول نكتة او أشير لحاجة معينة المفروض انها واضحة لكن مش بتفهم او على الأقل اللي قاعد معايا مش بيفهمني...

بالنسبة للأمراض زي  فهل في طبيب نفسي شخصك ولا حضرتك معتقد كده؟ لان نظرتك لنفسك مهمة جدا واعتقادك في نفسك بيتحول لحقيقة مع تعودك على الاعتقاد ده وايمانك بيه...شخص مكنش كسول ولا حاجة بس كان معتقد انه كسول فعلا مع الوقت هيبقى كسول ودي مش ظاهرة خارقة للطبيعة دي مجرد ....

شايف انك تدي نفسك فرص كتير اوي، مش لازم تتأقلم ولا حاجة، مفيش مانع انك تفضل فريد ومميز ومتستعملش كلمة مختلف لانها مش منصفة...متتجنبش الناس او تخاف تتعرف لان الانسان بدون العلاقات مجرد صدفة فارغة ودي طبيعتنا، قرب للناس اللي بتحبها اكتر وقوي علاقتك بيهم وابذل شوية جهد في تحسين حياتك زي انك تشد في مذاكرتك او شغلك وتنزل جيم وبدون ضغط، ابدأ واحدة واحدة ...الأهم من دا كله في نظري هي انك تقوي علاقتك بربنا، التزام بالصلاة في اوقاتها وصلاة السنة وسماع وقراءة القرآن والدعااااء الكتييييير أثرهم عظيم جدا ونا مجرب الكلام ده والله.",607655,,Askmasr,,,693054,control,True
1,هتلاقيهم بس في الغالب هتلاقي في عقبة انكم تكملوا زي ما حصل معايا,795224,,Misr,,,165673,control,True
2,مهي دي الفكرة انه العلم الي باللغة العربية فيه تحيز كبير فشخ+ علشان كده لو بالعربي كنت هقراء ادب وبلاغة وشعر بس لاكن مش تاريخ.,742903,,ExEgypt,,1733932895.0,454510,anxiety,True
1,حالي حالك تغيرت الخطة فبدل ما اروح اليابان رحت لدولة قريبة منها,335947,,saudiarabia,,,193506,control,True
1,"""تتوهم انك بقلب احدهم ،ثم يأتي موقف
يجعلك تضحك على سخافة ظنك . """,239755,,jordan,,,196278,control,True
2,مافهمت فقرة الدببه لكن قاعده تقارنين عربيات الرضع ب عربيات ذوي الاعاقه انتي غريبه يعني الفرق كبير واحد انتي تقارنين رضيع بشخص اكبر يعني هذا الشخص بيكون له ذكريات شي بيستمتع فيه وشي بيتذكره بعدين اما الرضيع وش بيتذكر وعلى العربيه عربه ذوي الاعاقه ينشاف الي قدامه السبب انها بالعرض عكس الرضع بالطول لان ما تلاحظ درجه القرب كانك تسوقين سياره ما تعرفين طول صدامها ولا عندك حساسات طبيعي تصدمين او تحكين صح ولا,567359,,SaudiForSaudis,,,328444,control,True
1,لو مفيش فرق كبير بين المرتبين ، روحي المكان الهادي,871132,,AlexandriaEgy,,,973133,control,True
1,"لا انت قاعد تشكي من وضع النساء مع الاطفال وكأن الاطفال فيهم شي

.#نطالب\_بحقوق\_الأطفال",609562,,SaudiForSaudis,,,538507,control,True
2,"حصل خير ممكن اكون شخصنتها شويه اعتذر، 
بس ده اسلوبي في المدح خصوصًا اني بقرف من اي حد خاصةً البنت اللي بتقلل من بنت فبتجنبه رغم ان فكرتي بردو صادقه بغض النظر عن اسلوب حديثي 
ممكن انت بتحب تكون بسيط في المدح عادي",468893,,Egypt,,,326426,control,True
1,"ايه الفايدة؟؟ انا واحد مهندس وفي شغلي بتعامل مع هنود واوروبيين وافارقة، هستفاد ايه من تعريب العلوم؟ بالعكس شغلي هيبقي اصعب ١٠٠ مرة.

هو العلم المفروض يسهل حياتنا ويخليها احسن، مش وسيلة للاعتزاز بالأصل واللغة ، والفشخرة.",273811,,CAIRO,,,752521,control,True
1,ما جبت شي من عندي، بس عادي، بالعكس,422829,,SaudiForSaudis,,,342147,control,True
1,ان الامل جهدٌ عمل و الجهد لا يضيع ... الامل جهدٌ عمل,135121,,jordan,,,232808,control,True
5,"اللي حماس عملته كان غلط وغبي وأنا مش بنكر ده 

بس ايه رأيك في اللي بيحصل قبل  اكتوبر على مدار سنين لحد النقطة دي، الناس دي كانت عايشة في سجن مفتوح ومعرض اي يوم جندي اسرائيلي يدخل بيتك ويقتلك من غير اي حساب حقيقي. جربت حظك مع كل الحلول الديبلوماسية ومش معترف بيك كدولة أصلا، اي حد في الظروف دي قدامه ايه تاني يتعمل؟

أنا برضو مش بقول اللي حماس عملته مبرر في قتل مدنيين بس هل هو سبب ل ?",688395,,ExEgypt,,,114477,control,True
2,"المهم عنده انه بيوصل المعنى المقصود وخلاص من وجهة نظره. 
العكس بقى لو كتب حاجة انجلش غلط و صححتهاله هتلاقيه تقبل الفكرة و بقى مركز جدا انه يكتبها او ينطقها صح، بس عشان الانجلش بيمثل برستيجة و مكانته قدام الناس و قد اية هو جامد فهيبقى واخد باله منه جامد لكن العربي عادي معندوش مشكلة انه يبقى اهبل مش عارف يكتب لغته الاصلية و لو حاول يقرا قصيدة او مقاله هيقرا كلمات كتير غلط.",992550,,Egypt,,,805215,control,True
1,هو الأحسن إن لو حد واجهك بالكلام اللي قولتيه تقولي إنها مجرد لحظة غضب و زلة لسان و قولي استغفر الله كتير,883552,,ExEgypt,,,194836,control,True
1,"غالبا ياشباب انا همشي بنسبه كبيره وبردو زميلي اللي معيا بردو هيمشي 
انا بس مستغرب من الناس دي لان انا وزميلي ده وقفنا معاهم كتير اوي وعملنا حاحات كتير معاهم متتقدرش بفلوس والله 
يلا حسبي الله ونعم الوكيل",154607,,AlexandriaEgy,,1721568970.0,553972,suicide,True
2,"طب متقعد تتكلم مع اخوك وتخليه يعمل اللي انت عملتو واقعد مع مرات ابوك وقولها اي حاجه اخويا يعملها كلميني انا وانا احلها.. 
خليك كبير واحتويهم وتوصلهم لحتت ان اي حاجه تحصل انا المسؤول وتعالو قولولي..
المفروض ابوك يبقي هوا اللي عنده الحته دي بس غالبا كده ابوك مش مهتم",737331,,EgyptExTomato,,,503440,control,True
44,"سندوتشات الجبنة الرومي السايحة هتغير حياتك
هتعالج اكتئابك
هتحسن علاقاتك
هتحسن حياتك الجنسية
علاقتك مع اهلك هتبقي حلوة
هتبطل السجاير
هتروح الجيم
كل دا من سندوتش الجبنة الرومي السايحة
الجبنة",731427,False,ExEgypt,سندوتشات الجبنة الرومي السايحة,1700106757.0,385522,autism,True
1,"أنت قولت حاجة هو مقالهاش هو قال بلاش دول الغرب عموما 
و الحادثة الي انت قولتها اكيد وحشة بس عموما مختلفة يعني اقصد مش هتبقي محاوط بناس بتكرهك زي الغرب او او او 
مش معني أن حادثة حصلت يبقي كلنا نهج
انا عايش في منطقة وحشة و شعبية بس لو خيرتني اروح بلد غربي امريكا او غيره و لا ابقي في مصر
هفضل هنا",397052,,EgyptExTomato,,1701349240.0,813146,depression,True
2,ماقد جربت غير  ك نت بيت، لكن اذا تبي نت جوال عن نفسي جربت شركات زي فيرجن و سلام و ياقوت و كان افضلهم من ناحية سعر و باقة ياقوت بالراحة، سلام هي الاسوء من الثلاث ذي لان خدمة العملاء حقتهم سيء و مرة قعدت احاول الغي رقم من عندهم ممكن ثلاث شهور، كل شهر يقولون تمام كنسلناه ثم الشهر الي بعد اشوف طالعة مديونية و على هذا المنوال…,849078,,SaudiForSaudis,,,800986,control,True
3,يغالي والله ريديت هو اللي مبيرداش يرفع الكومنت لو لقي مصطلحات زي اللي انا فاصلها وجربت ارفع الكومنت كذا مره ومترفعش فبضطر احطله فواصل....ماشي علي خطي امازون ف قمع حريه التعبير يالا هي جيت عليه,616642,,CAIRO,,1716051418.0,752661,depression,True
2,"انا كنت بحب القراية زمان و عايز الاقي حد بيحب القراية يشجعني ارجع - بحب الفيديو جيمز و اني اعرف الCulture بتاع بره سواء بقى اسمع اغاني اشوف افلام و مسلسلات الكلام ده
اصحابي بقى بيحبوا الكورة - يروجوا حجز كورة - يلعبوا فيفا - يشوفوا ماتشات - يشوفوا تيكتوكات ماتشات
اكتر حاجة كنت بحبها في وقت قبل كده كانت الالعاب بس جروبات الفيسبوك كلها شباب في اعدادي و انا مخلص كلية - لهم كل الاحترام بس الدماغ غير الدماغ",819398,False,CAIRO,ممكن الاقي فين ناس عندهم نفس اهتماماتي؟,,849735,control,True
3,"انا بتابعه لنفس السبب بس نقطه أن اليوتيوب مش المكان الي ناخد منه معلومات دي أمال منين ( بسأل بجد ) 
لأني شخصيا مش ببحث عن كل حاجه بسمعها منو أو من غيره ممكن بس لو الموضوع لفت انتباهي ابحث عنو غير كده بحس اني باخد المعلومه وخلاص",146628,,CAIRO,,,702058,control,True
1,كل واحد اتستر في حاجات و اتفضح في حاجات كلنا بمعني كلنا ، انت و نصيبك يعني,924701,,AlexandriaEgy,,,701862,control,True
2,بص بحس اني ساذج اصلا .. هي عارفه ان اهلي مش موافقين عليها ومصره تاجي هنا وكمان عاوزانا نعيش سوا وكل ما بقلها نسيب بعض تمسك فيا فشخ .. يسطا انا هلبس خازوق باين بس مش بسهوله بعرف اخد قرار زي دا وامشي,307038,,ExEgypt,,1714121222.0,719232,anxiety,True
1,"بعتذر على الكلام لكن مافي قدامي أي حل ثاني وقررت انشر يمكن حدا يساعد

 اختي طبيبة مُقيمة في المدينة الطبية وللأسف قرروا ينقلوها ل الزرقاء علمًا احنا سكان عمان والمسافة بعيدة جدًا وما معها سيارة ولا بتاخذ راتب بالعكس هي بتدفعلهم، و الوالد متوفي وانا متغرب والوالدة كبيرة و لحالها بالبيت

عرفت انه كل الدكاترة الموجودين مع اختي رفضوا ينقلوا ودبروها بالمعارف والواسطات واحنا للأسف ما عنا حدا يساعدنا لذلك بس هي الي بدهم يجبروها تنقل، هي حاولت تحكي مع المسؤول تفهمه وضعها لكن بهدلها وسمعها كلام غير لطيف

يمكن مش انسب طريقة بس قلت انشر هون يمكن في شخص ممكن يساعدها او ينصحنا لأنه والله العظيم مش عارفين نلاقي حل واختي كثير تأثرت من الموضوع لانها حست بالظلم وغياب السند",938974,False,jordan,مساعدة ضرورية في المدينة الطبية..,,294753,control,True
8,"انا هشرحلك. انت مصري المصريين مش عرب العرب هم العيشين في شبه الجزيرة العربية. المصري الذي يعرف نفسه كعرب ده بسبب انحياز ديني. الفكره ان الشخص المصري الي يعرف نفسه كعرب العرب مش بيعرفو بيه كاعوبي بيقولوا عليه ""اعجمي"". و اللغة المصرين ده مش عربيييي ده اعجميي و الاعجمي حاجة شبه العوبي احنا مش بننطق حرف زي القاف.",773721,,ExEgypt,,,618260,control,True
0,حقيقي الدين معرفش ولا هيعرف يعمل اخلاق لاصحابه، الدين مجرد اداة عشان توصلوا بيها لايًا كان الهدف من استخدامه. لكن كاخلاقيات هو بلح. الراجل استأمن اخوه على ورثه و و وثق في اخوه كفاية انه يقوله انه لا ديني و في الاخر اخوه يستغل دا عشان يأذيه بحجة الدين و انت كل اللي فارق معاك اذا دا مناسب لمعايير العلمانيين؟ انت معندكش مشاكل اتنين اخوات يكرهوا بعض تمامًا و حياة واحد منهم تتأثر بالسلب عشان بس ترضي الكبرياء الوهمي اللي الدين مديهولك؟,912736,,EgyptExTomato,,,623943,control,True
2,حصلت معايا برضو بس كانت على فيسبوك شوفتها صدفه في الارع و بعدين روحت كلمتها طلعت هي فعلا، و من هنا بدأت القصه,499320,,CAIRO,,,294350,control,True
6,"> وغير كل ده انا قريت وعرفت ان الزواج بامراه في السن ده لا يجوز الا بموافقتها ، اذا هي موافقه وعارفه وهي بتعمل ايه

""تَزَوَّجَنِي النَّبيُّ صلَّى اللهُ عليه وسلَّمَ وأَنَا بنْتُ سِتِّ سِنِينَ، فَقَدِمْنَا المَدِينَةَ فَنَزَلْنَا في بَنِي الحَارِثِ بنِ خَزْرَجٍ، فَوُعِكْتُ فَتَمَرَّقَ شَعَرِي، فَوَفَى جُمَيْمَةً، فأتَتْنِي أُمِّي أُمُّ رُومَانَ وإنِّي لَفِي أُرْجُوحَةٍ، ومَعِي صَوَاحِبُ لِي، فَصَرَخَتْ بي، فأتَيْتُهَا لا أدْرِي ما تُرِيدُ بي، فأخَذَتْ بيَدِي حتَّى أوْقَفَتْنِي علَى بَابِ الدَّارِ وإنِّي لَأُنْهِجُ حتَّى سَكَنَ بَعْضُ نَفَسِي، ثُمَّ أخَذَتْ شيئًا مِن مَاءٍ فَمَسَحَتْ به وجْهِي ورَأْسِي، ثُمَّ أدْخَلَتْنِي الدَّارَ، فَإِذَا نِسْوَةٌ مِنَ الأنْصَارِ في البَيْتِ، فَقُلْنَ: علَى الخَيْرِ والبَرَكَةِ، وعلَى خَيْرِ طَائِرٍ، فأسْلَمَتْنِي إلَيْهِنَّ، فأصْلَحْنَ مِن شَأْنِي، فَلَمْ يَرُعْنِي إلَّا رَسولُ اللَّهِ صلَّى اللهُ عليه وسلَّمَ ضُحًى، فأسْلَمَتْنِي إلَيْهِ وأَنَا يَومَئذٍ بنْتُ تِسْعِ سِنِينَ.""

اقرأ الحديث ده، انت شايف ان هي كدة موافقة؟؟ ثم معلش يعني هو لو جيه أي طفل دلوقتي قال عايز أتجوز هل هتجوزه؟؟ لأ طبعا عشان ده طفل و مش فاهم هو بيقول ايه و مش فاهم الجواز عبار عن ايه

> وغير ان ده نبي يعني هو مش بيختار اي شخص كده وخلاص هو فعلا عارف بيختار مين وليه طبعا وحي من ربنا

و هو الإله كلي القدرة و كلي العلم مكنش لاقي طريقة أفضل من كدة ينشر بيها الدعوة؟؟ مكنش يعرف ان موضوع زواج من طفلة عندها  سنين هيبقى موضوع جدلي في المستقبل و عيبة في حق محمد؟؟",718608,,ExEgypt,,,446705,control,True
1,انا مبهدلتش حد معايا يسطى، واه اقدر على ايجار عادي,604301,,Askmasr,,,609803,control,True
2,نزلت يسطا كلهم فلاحين ولاد وس$خه  اعظم واحد فيهم معهد مص زب$ار  و الشغل حرفيا عبوديه و عشان رايح جديد بيتعاملو معايا اني غبي مش بيتعاملو معاك انك اول مره تعمل الحاجه,469395,,ExEgypt,,1724023623.0,570305,suicide,True
2,أنا لست سيئة جدا في العربية ،وان اوحى المنشور بذلك (كتبته على عجلة و لم أركز+الاوتوكركت)لقد قرأت الكثير من الكتب الادبية قبلا ككتب طه حسين و المنفلوطي الخ،لكن أريد تحسين كتابتي اكثر,612799,,arabic,,,226416,control,True
1,صراحة الحمدالله بعد معاناه طويلة من عدم تقبل ومهما اوصل ما افرح الى انه صرت استمتع بكل شي اسويه وقد ما اقدر ما اربط سعادتي بشي معين لانه مرهق نفسيا تحطي سعادتك في هدف بعيد,552071,,saudiarabia,,1711990829.0,386262,anxiety,True
2,اذا بالرياض توجه لأقرب فرع عندك تلقاهم طالبين قد دخلت فرعين وحاطين اعلانات انهم محتاجين,911997,,SaudiForSaudis,,,328644,control,True
2,انت متخيل ان شركه ف الموساد هتحول تحويلات بنكيه مرصوده يعني اظن الموضوع هيكون مستخبي عن كدا,383509,,Egypt,,,458932,control,True
21,ومره كنت داخل الحمام لقيت واحد مقلط قلوط كبير نييييييييك وطالع برا القعده افتكرته تعبان وقعدت اصوت للداده,252816,,CAIRO,,,362709,control,True
1,شوف هقولك على حاجه ربنا قال {وَمِنْ آيَاتِهِ أَنْ خَلَقَ لَكُم مِّنْ أَنفُسِكُمْ أَزْوَاجًا لِّتَسْكُنُوا إِلَيْهَا وَجَعَلَ بَيْنَكُم مَّوَدَّةً وَرَحْمَةً إِنَّ فِي ذَٰلِكَ لَآيَاتٍ لِّقَوْمٍ يَتَفَكَّرُونَ} و برضو قال (يَوْمَ يَفِرُّ الْمَرْءُ مِنْ أَخِيهِ * وَأُمِّهِ وَأَبِيهِ * وَصَاحِبَتِهِ وَبَنِيهِ) يعنى اولا المفروض لما اتنين يرتبطوا ببعض يبقوا قلب واحد و بيخافوا على بعض و حرفيا تسكنوا اليها  يعنى كل واحد مننا يكون كانه فى البيت اللى بيرتاح فيه و يسكن فيه و يشعر بالسكينه بعيد عن ضغوط الحياه و البنت بطبيعيتها حنينه و طيبه و عاطفيه و كأنها هى مصدر الشعور بالسكينه و الملجأ اللى حرفيا لو الدنيا كلها ضدك و هى معاك هتحس انك تقدر تكمل ️ و هى اللى فى يوم هتكون أم اولادك و هتكون الجنه تحت اقدامها مش أقدامنا احنا كرجال.  و الايه التانيه ربنا يستشهد ان الإنسان من أهوال يوم القيامه بيجرى من اقرب الناس اليه و هى بتكون بعد الأب و الأم مباشره و قبل الأبناء كمان علشان كده تلاقى الراجل احيانا كتير عنده الزوجه فى مقام اعلى من الأبناء نفسهم. و احنا كبشر بندرس و ننجح و نعمل فلوس و عايزين عربيات و لبس و فخامه و سفر علشان فعلا كل ده جميل لكن الحقيقه انك كل لحظه من دول بالفطره الطبيعيه اللى جوانا هتكون احلى مع انسانه بتحبك و تحبها ️ لو بعد كلللللللل ده و الانسانه اللى المفروض تبقوا لبعض شعله من الحب و ال  لبعض ما تحترمش دموعك يبقى ما تستاهلش ترتبط بيها أصلا و انت كراجل لو ما حاولتش كل يوم انك تكون سبب انك عمرك ما تشوف دموعها و تشوف ضحكتها برضو يبقى ما تستاهلهاش. الحياه الزوجيه المفروض ماتبقاش صراع مين اللى يمشى رأيه لكن المفروض تكون سباق ان كل واحد يسعد التانى و يبنوا حواليهم قصر كبير من الحب و الموده و الرحمه ‍️️,326069,,CAIRO,,,876158,control,True
3,"سلام عليكم انا كنت عاوز اتعلم مونتاج واشتغل بيه اونلاين 
كنت عاوز اعرف المواقع اللي بتدعم السحب في مصر يعني عشان حوار الدولار وكدا + هل لازم يكون ليا حساب في البنك ولا في مواقع بتدعم فودافون كاش مثلا ؟",952645,False,EgyptianFreelancers,مواقع الفريلانس اللي شغاله,,326234,control,True
1,اسف مكنتش واخد بالي إني بكلم ملحد أنا برضو كنت مستغرب الصياغات دي متجيش غير من ملحد لا أنا أصلا مش هخس معاك في نقاش خسارة فيك دا انت حتي بالأحاديث والسيرة مجبتليش حاجه وكله كلام انت بتقولو بطريقتك ف طالما مش هنجيب ادلة يبقي شوفلك كلبه تنيكك او قرد تنيكه طبعا,263389,,EgyptExTomato,,1716930469.0,806738,depression,True
1,"خبيييير لو أنك رافضة نبي أستغفرالله
عشان يسووا كل هذي المصخرة",455359,,SaudiForSaudis,,1733205237.0,749184,depression,True
1,في سبايك يصدقون اي شيء. وفي بعض المستعربين يدورون الزله على السعوديه,279860,,saudiarabia,,1714830256.0,777978,ocd,True
3,ما ده اللي بتكلم فيه ، هو ابويا عنده حق في حتة ان لو واحدة صغيرة هفضل شايفها صغيرة حتى لما اكبر بس الفكرة في الارتياح يعني والله مش سهل في الزمن ده تلاقي واحدة جميلة و في نفس الوقت مريحة,865721,,Misr,,1728819566.0,558488,anxiety,True
1,أولا جسدك ملك لله مالك حق انك تؤذيه والتبرع مؤذي وقد تحصل مضاعفات وشوفي كلام العلماء فيها. ثانيا، في دعاء كانَ النَّبيُّ صلَّى اللَّهُ عليْهِ وسلَّمَ يدعو بِهِ اللَّهمَّ بعِلمِكَ الغيبَ وقدرتِكَ على الخلقِ أحيني ما علمتَ الحياةَ خيرًا لي وتوفَّني إذا علمتَ الوفاةَ خيرًا لي وأسألُكَ خشيتَكَ في الغيبِ والشَّهادةِ وَكلمةَ الإخلاصِ في الرِّضا والغضبِ وأسألُكَ نعيمًا لاَ ينفدُ وقرَّةَ عينٍ لاَ تنقطعُ وأسألُكَ الرِّضاءَ بالقضاءِ وبردَ العيشِ بعدَ الموتِ ولذَّةَ النَّظرِ إلى وجْهِكَ والشَّوقَ إلى لقائِكَ وأعوذُ بِكَ من ضرَّاءٍ مُضرَّةٍ وفتنةٍ مضلَّةٍ اللَّهمَّ زيِّـنَّا بزينةِ الإيمانِ واجعَلنا هداةً مُهتدين. ثالثا، لا تخلي فترة ضعف تغلبك في ناس انسجنوا بيصدنايا وقعدوا فوق ال ١٤ سنة وفيهم يلي قعد ٤٠ سنة مع كذا عاش وان شاء الله حالهم للأفضل وتحملوا العذاب النفسي والجسدي وسوء التغذية والبرد والحر. إن بعد العسر يسرا، وعسى أن تكرهوا شيئا وهو خير لكم، لا تقنطوا من رحمة الله. اقرأي القرآن واجعليه ربيع قلبك ونور صدرك. عسى الله يفرج همك وييسر أمرك,236135,,SaudiForSaudis,,,221358,control,True
1,مستعد الصدق تقلب كذا لان هذي اسبوعين بس فكيف اللي بقى من ال٦ شهور,621343,,saudiarabia,,,268981,control,True
