score,selftext,id,over_18,subreddit,title,created_utc,author,condition,is_arabic
2,ما تفاجأت من كلامك ابدا. اتمنى بالمستقبل تتنظف المدارس من هالاشكال.,825049,,SaudiForSaudis,,,792269,control,True
1,"مثثثلللكك!!!!!

اقسم بالله نفس وضعك بالضبط ونفس الفكره اني قلت برفع سعراتي وبعدها هجت معي

وصدق الله يقوينا ياررررب بس ابي حل انا",333998,,saudisinshape,,,640251,control,True
1,يوميا من ٧ الصبح الى ١٠ بالليل صدقني مابالغ يوم اقول لك نشبة اللي بتذكره فيه انه نشبة وبالعكس هالشي هذا يمكن يخليني انسى محاسن وهالشي هذا مابيه,176751,,SaudiProfessionals,,,722178,control,True
0,مستشفى الدمرداش مركز الدكتور أحمد عكاشة..ده اكتئاب..الكشف بمبلغ رمزي..تعالي و الحقي نفسك..,517690,,AlexandriaEgy,,1730538453.0,312563,anxiety,True
1,لو ارجع صغير واكون ارد على امي، لأنه كل اشي كانت تقولي إياه صار معي وكان معها حق وصابني اشياء لو اني رديت كان ما صابتني,628044,,jordan,,,550906,control,True
4,". 

بس اسيب كل الاحتمالات واتولد جاي في مصر في عيلة سلفية ده       حقيقي.",868347,,ExEgypt,,1733589105.0,293760,anxiety,True
24,"فيه مثل امريكي بيقول:  
""           ""

يعني لو الموضوع كويس بزيادة على انه يكون حقيقي، يبقى هو في الغالب كده فعلا (كويس بزيادة على انه يكون حقيقي يعني مش حقيقي)",962423,,Egypt,,,241485,control,True
11,عايز اسأل سؤال ممكن يكون غير أخلاقي بس حد عنده تجارب جنسيه وازاي أمن نفسي كويس من الأمراض او اني اتصور ويبتزني عموما واعيش رعب فتره من حياتي و يحصلي مصيبه وهكذا لو حد عنده تجارب او لو في حد هنا اصلا علطول بيمارس وعنده خبره ازاي اعرف ان الي عايز يمارس معايا ظابط مثلا او عنده ايدز كده يعني,782671,False,ExEgypt,,1711756677.0,115499,adhd,True
1,الحساب قديم جديد ؟ تبند قبل هيك ؟ عملت حسابات ع نفس التلفون وصرت تحول بينهم توكنز ؟,960687,,jordan,,,934402,control,True
4,لو قرأت السطر الثاني من كلامي بتعرف اني ما جمعت و أيضًا قلت بأن العالم و ليس الغرب فقط ينظر لنا بهذه النظرة.,556999,,arabs,,,113095,control,True
149,"اسميه المتحرش اللطيف 
بكرا بيقولك بعيونك حزن انا افهمك و احس فيك 
ما عمري شفت انسانه مثلك عيونك فيها لمعه جذبتني  
انا اشوف سلكي ولا تتجاوبين بيحس ب الاحراج",390592,,SaudiForSaudis,,,425471,control,True
58,غلطت في حرارة الفرن فا القلب طلع طري زيادة عن المطلوب ولكن الطعم رائع رائع رائع,575272,False,CAIRO,نجاح باهر يا شباب ولكن محصلش الامتياز,,469435,control,True
2,انا فاهم بس قصدي هل مشكلتي في السفر هتبقا بسبب الجيش ولا الدولة؟,620497,,ExEgypt,,1699604559.0,305585,depression,True
1,"المتدينين بيعانوا من ادمان الاباحية زي الغير متدينين بالظبط. 

سجون العالم مليانة متدينين، فا فكك من الجو ده، مش فكرتين تلاتة انت حافظهم وبترددهم في دماغك اللي هيخلوا حياتك احسن او هيجيبولك سلام نفسي.",577478,,EgySexEducation,,,796110,control,True
1,انا بحب فيه انه رجل مثقف وعقلاني وبيتكلم بعمق. يا ريت كلنا نبقي اوروبيين ومثقفين,734629,,ExEgypt,,,669188,control,True
1,"هل سلوك (الحماس المفرط غير العقلاني لأي قضية او معتقد صاحبه لا يقبل الرأي المقابل و بيتعامل مع الرأي المخالف بعدم مرونه وممكن ينتج عنه رد فعل حاد أو هجومي أو عنيف) في المطلق أمر سيء؟ هل شايف انه مستحيل في أي قضية السلوك ده ممكن ينتج عنه نتائج إيجابية؟

لو شايف إن السلوك المذكور في المطلق أمر سيء/سلبي فانت بتقول إنه سيء لذاته زي مثلًا قاعدة ""الكذب دائمًا خطأ""، وده أنا أتفهّمه من منطلق لاعواقبي دي-أنطولوجي أو حتى فضائلي، لكن لو بتقول انك عواقبي وشايف إن السلوك المذكور مستحيل ينتج عنه أي نتائج ايجابية وفي حال نتج أمور إيجابيّة هل وقتها السلوك مش هيبقى (حماس مفرط غير عقلاني....)؟ ولا هيبقى نفس التعريف لكن وقتها هتطلق عليه اصطلاح تاني غير ""التعصب""؟

هل انت مشكلتك اصطلاحية؟ لو واحد مثلًا كذب علشان ينقذ حياة طفل، هل وقتها هنقول على الكذب اصطلاح تاني غير الكذب علشان المصطلح ده له دلالات سلبية؟",197973,,ExEgypt,,,892209,control,True
1,">عم بيتاخدوا أسرى بس الشرطى المصرى اتصرف من دماغه و لوحده

انا عارف انا مش بتهم الاسلام اصلا انل شايف قواعد الدين للحرب اكتر عدل من حاجات كتير، انا بس قصدي الناس الي بتقتل وتمثل بالجثث ده مش حرام ؟",832845,,EgyptExTomato,,1696846191.0,869587,depression,True
1,"شايفني بفطر كورن فلكس وبتعشي سوشي
مانا في ام البلد معاكوا",523796,,AlexandriaEgy,,,875100,control,True
21,"دا مكافئ القهوة البلدي الرخيصة عندنا بس اضافة ان عندهم متاح بيرة وكحوليات بس كوباية الشاي ام ١٠ جنيه المعفنة لسة عندهم برضو

انت بقى حواليك كام قهوة بلدي في المنطقة 

الموضوع ثقافي واجتماعي اكتر ما هو ديني، الحمدلله على نعمة الاسلام وكل حاجة بس وجود العدد دا لا يدل الا على الترابط الاجتماعي والثقافي عندهم وخصوصا في الماضي لان معظم الحانات دي قديمة، زي ما ناس الحارة كلها بتتجمع على القهوة البلدي",121131,,CAIRO,,,926917,control,True
1,حد صحبي جاب .% علمي علوم فعايز يعرف لو هيلحق طب بشري او اسنان في حلوان الاهليه,336163,False,Egyptiandoctors,جامعه حلوان الأهلية,,828704,control,True
5,"تموف اون من هدف ؟ افتكرتك تقصد من علاقة
طب وليه تموف أون من هدف.",813707,,ExEgypt,,,157028,control,True
1,"ياريت ترشحولنا اماكن نشتري منها واسعارها معقوله ولا عالية 
وكمان لو فيه اي نصايح في اختيار اللبس افيدونا وشكرا ️",705314,False,masry,بتشتروا لبس الشتوي منين,1695484356.0,805981,depression,True
4,"سخن الفرن وحط اصبعك عليه وشف كان تحملت ثانيه هل يستاهل انك ممكن تتعذب بقبرك ويوم القيامه وفي جهنم عشان والله شهوه وترا الشهوه هذي لحظة لذة وتعقبها سنين حسره وندم واول ماتسويها اصلا بتحس بالندم وحرمان رزق وقلة توفيق وضعف ايمان يعني بتضيق على نفسك بالدنيا والاخرة هذا غير الامراض وانك ماراح تحصل اصلا علاقة بتكمل لنها علاقة ماترضي الله وتدري اصلا الشيطان وش هدفه انك تكفر بالله وهو ماراح بيخليك تكفر فجأة في شي اسمه خطوات الشيطان بيجيبك حبه حبه وايمانك بيضعف مره من كثرة الذنوب (كلا بل ران على قلوبهم ماكانوا يكسبون) توصل لدرجة الران ثم الختم ثم يقفل على قلبك اذا تتابعت الذنوب بدون توبة حقيقه وليست توبة كاذبه ان تقول بأترك الشيء وانت اصلا ماعندك لاعزم ولانيه صادقه انك تتركه ومن عقوبات الذنب ذنب يتلوه وعلى فكره استمرارك بالذنوب بيجيب لك عقوبات من الله زي ماذكرت وان كملت في غفلتك ونسيت ربك يتركك لنفسك عشان تزيد في الطغيان ثم يأخذك بغته الى عذاب اليم وهذا اشد من ان يبتليك في الدنيا (ولعذاب الاخرة اكبر) (فلما نسوا ماذكروا به فتحنا عليهم ابواب كل شيء حتى إذا فرحوا بما أوتوا اخذناهم بغتة فإذا هم مبلسون) ومن الجانب الدنيوي تدري انه اذا كنت في علاقه ورا علاقه ومع حرمه ورا حرمه اذا تزوجت ماراح ترتاح بيكون ودك تنوم مع هاذي وتكلم هاذي لأنك متعود انك تكلم مليون حرمه.

وتذكر ان من ترك شيئا لله عوضه الله خيرا منه ثق بالله وعوض الله كبير عوض ممن بيده خزائن الارض والسماء وتذكر (واما من خاف مقام ربه ونهى النفس عن الهوى فإن الجنة هي المأوى) (ولمن خاف مقام ربه جنتان) وتذكر حديث الرسول ان النصر مع الصبر وان مع العسر يسرا فلاتحسب ابدا انه الوضع بيكون كذا دايم اليسر والفرج بيجي ولو بعد حين خلك متأكد من هذا الشي دايم مع العسر يسر.",202279,,SaudiForSaudis,,,500296,control,True
2,انت حارقك اوي ليه الناس بتعمل ايه في اوض النوم؟ لا بجد؟ سؤال بسيط.,248249,,ExEgypt,,1690575047.0,646024,anxiety,True
7,مثلاً طبيعي الانسان يقضي حاجته لكن لو قضاها امام الناس بيكون الوضع مقزز ف البعض يشوف انه مو المكان المناسب حتى لو كان هذا شي طبيعي,475055,,SaudiForSaudis,,,162640,control,True
1,"مهو مفيش حد هيديك فلوس لسواد عيونك, محتاج يكون عندك شوية .
لو مش عايز تتعلم حاجة ممكن تنزل تقف كاشير في اي مكان.",785453,,Egypt,,,870675,control,True
3,قفله    اول حلقه بالسيزن الاول ما ادري ليش بس مره احبها,581385,,SaudiForSaudis,,1710676809.0,767726,adhd,True
4,لأ سيبك من سعيد عبده ده لامم حواليه شوية ناس بسيطة و بيضحك عليهم، ركز مع الكنيسة الأرثوذكسية نفسها اللي للأسف دكاترة و متعلمين و أغنياء بيتبعوها و مصدقين التخاريف بتاعتها,853322,,ExEgypt,,1708117415.0,948235,anxiety,True
12,"انا بحب اتفرج علي فديوهات السياح اللي بيجو بلدنا ولاحظت في الفديوهات العربية ان السايح العربي بيبقي ليه تخفيض او بيدفع زي المصري ومش فكل الاماكن بصراحة فيه فديو لسائحة في قلعة صلاح الدين دفعوها بتسعير الاجانب بس فديو تاني للمتحف المصري في التحرير مكتوب في يافطة تسعيرة موحدة للمصري والعربي ف ليه العربي يدفع زي المصري في الاماكن السياحية؟ مع ان المصري بيدفع زي الاجنبي في الاماكن السياحية في الدول العربية هل اللي بنعمله ده صح؟ بنخسر فلوس علي الفاضي حتي مش بناخد في مقابل ده تخفيض لما نسافر بلادهم ومين بدأ موضوع التخفيض للعرب ده اصلا؟ فرق سعر رهيب بين 30ج و300ج

[الصورة من فديو سائح جزائري بتاريخ   ]( ممكن تكون الاسعار اتغيرت.

[المتحف المصري بالتحرير](",371734,False,Egypt,هل من الصح ان العربي يدفع زي المصري في الاماكن السياحية؟,,830741,control,True
1,الفضول لا غير لأن كل ما اسأل سؤال القى واحد بريديت سألها من ٨ سنين + اعجبتني فكرة الموقع إنه انت تسأل و ذوي المعرفة يجاوبون,608613,,AlexandriaEgy,,,205487,control,True
1,"أنا عارف يمكن حد قرا البوست بتاعي قبل كدا
بس فعلا أنا مش عارف اعمل ايه أنا تعبت أنا بدور علي واحده شديده قويه متحكمه
تبقي الراجل بتاعي تحكمني وتشكمني
هل فعلا موجوده ولا لا نفسي حد يجاوبني",794325,False,EgySexEducation,هاي,,892714,control,True
-5,"تأخر الأمم العربية ليه اسباب كثيره
منها الاقتصادي والاجتماعي والسياسي

ولكن الأسباب السياسية سببها الديكتاتورية وغياب الديموقراطية
مش مرتبطة بالعلمانية والاسلام بشكل مباشر",824464,,EgyptExTomato,,,129112,control,True
14,"هسة انت معترض على الي يكوله لو منصدم من مستواه الديني ؟ 
يعني والله ترا صدك علاقات محرمة وبالنسبة للايك ما يريد يكسب ذنب على الاغاني 
كلام صديقك مألوف الي
اتذكر مرة كلت لصديقي علاقات محرمة كفر بية ، شدعواكم عمي",655008,,Iraq,,,278433,control,True
10,"اول شرارة بنسبالي كانت فكرة الحجاب ان ليه الست محتاجه تتحجب و تستر نفسها و حتا حاجه زي شعرها اللي مش هيسبب اي انجذاب جنسي ليها تغطيه مع ان عوره الراجل فالإسلام بتبدأ من تحت السُره إلي فوق الرُكبه يعني هل لو راجل مهتم بجسمه و عنده عضلات و مشي فالشارع ب شورت مثلاً يستر عورته بس لسه مبين بقيت جسمه، هل ده مش هيفتن النساء؟!
بس و من هنا بقالي ٥ سنين ملحد",234612,,ExEgypt,,,111014,control,True
2,"والله يصاحبي اكتر من  فريم بالنسبالي مية مية فمبهتمش اني اقيس الفريمات الصراحة بس ذا ويتشر بتشتغل معايا على ٩٠ فريم تقريبا  و ريزدنت ايفل ٢ كنت بلعبها  على شاشة التلفزيون و فالورنت برضو بتوصل  فريم ، كل الالعاب بتشتغل على  وبفريمات عالية ومستقرة

العيوب بصراحة: المراوح صوتها ساعات بيبقى عالي فبضطر اعلي صوت اللعبة عشان اغطي على الصوت، سماعات اللاب صوتها حلو بس واطية شوية فبعليها ببرنامج اسمه ، الوان الشاشة لما جت كانت باهتة فظبطها من برنامج نيفديا وبقيت حلوة، البينج على الوايفاي سيء فلازم كابل لان لو بتلعب اونلاين

دي قناة واحد أجنبي معاه نفس اللاب بيجرب عليه كل الالعاب بس هوا مغير الstock  عشان بيقول بتدي زيادة في الفريمات %",594008,,EgyptTech,,,905655,control,True
1,ليش الرجال يعجبوا بالحريم ،وضعهم غريب ومبالغ فيه ، ولا عمري اعجبت برجل أو حتى ركزت معاه عشانه بس (رجل) ! شفت في التيك توك مدربة بتعطي دورة للرجال ولو تشوف تعابير وجههم وتركيزهم فظييع وأتوقع كله عشانها حرمة ، فليش الرجال كذا مع الحريم والله وضعهم غريب ، اوك فاهمين أنها فطرة بس أحس أنهم مبالغين في الإعجاب والاهتمام وياكثر المرات الي يعجبوا بشيء مايستحق الاعجاب بس لأنه الي يقدمه حرمه ! على عكس الحريم ماتشوفهم معجبين بالرجال لهذي الدرجة وقليل احد يعجب بشيء بس عشانه مرتبط برجل ! مرلت أقول ليش الرجل تعجبه ساق المرأة وممكن تفتنه وهيا مجرد ساق لحم وعظم يمشي فيها الدم يعني مافيه اي شيء مثير ! سبحان الخالق,171128,False,SaudiForSaudis,ليش الرجال يعجبوا بالحريم ، وضعهم غريب,1716431693.0,294462,depression,True
3,مش فاهم ازاي المفروض الاقي بوزيشن عندهم ، يفضل انه يكون من البيت لانهم تقريبا الشركة الوحيدة اللي عندهم ريموت,189373,False,EgyRemoteWorkers,ازاي اشتغل في,,427136,control,True
1,">ببساطة ولا ادعائي ولا ادعائك عليه دليل بربع جنية و القرآن هنا هو اللي عمل مغالطة منطقية بإنه اعتبر إن عدم مقدرة النمرود إنه يجيب الشمس من المغرب تعني إن ""الله"" هو اللي بيأتي بيها من المشرق،و دا أ ب مغالطات منطقية

هو انت شايف الموضوع من منظور القصة، لكن هو كان جدال بين ٢ واحد بيقول انا الإله و واحد بيقول انا رسول من الإله،  المفروض ان الإله الخالق يقدر يعمل حاجة زي انه يخلي الشمس تطلع من المغرب، و الا ميبقاش اله لو معندوش القدرة فلما النمرود مقدرش ،كده يبقى انتفت عنه صفة الألوهية، هل ده كده يثبتها بشكل عكسي لله، هتقول لا ، طب ليه النمرود مقالش كده ،  عشان لو طلب منه كده و حصل هيبقى إثبات انه كده و هيكون واضح للجميع ، لكن هو فضل يسكت و ميكملش المناظرة، لكن لو كان طلب كان حصل ، و خد بالك القرآن لو هو تأليف كان ممكن يدعي انه طلب و ان ربنا أتى فعلا بالشمس من المغرب لكن ده محصلش لانه بهت و محبش كدب يظهر للبلد كلها.",138724,,ExEgypt,,,237875,control,True
2,"متشكرة جدًا، 
معرفش إزاي دي حاجة تتطور، لو عندك اقتراحات أحب أسمعها.",446382,,ExEgypt,,,602648,control,True
11,حرفيا رحت ٥وظايف وكلها ماكملت فيها ، وحدة بس الي كملت فيها شهر اقصى مدة ، دحين قررت اني ما اقول لأصدقائي عن وظيفتي الجديدة الين ما استقر ان شاء الله ، بس اخاف يزعلوا او يشيلوا في خاطرهم او يقولوا اش معنى تخبي علينا ، صديق واحد بس الي قلت له عشان كنت خارج معاه ورايح معاه لمشوار ، فأخاف اذا عرفوا انو هذا بس الي يدري يحسبوني افضلوا عليهم او شيء ..,703497,False,SaudiForSaudis,ما أبغى اقول لأصدقائي عن وظيفتي الجديدة,1730794250.0,880390,depression,True
1,او مثلا ممكن تجالسين اطفال او تشتغلين بروضة او حضانة شوفي المتاح,519122,,jordan,,1708946572.0,998829,anxiety,True
1,"انت متكلمتش خالص عن المشكلة، هل المشكلة مع مراتك؟ مش بتسعدك؟ مش بتعرف تتكلم معاها؟

من كلامك رحت تكلم بنات وتجاوزت معاهم دى تصرفات مراهق. ف هل ست كمان دى اللى هتحل المشكلة؟ ولا نفس السيناريو هيحصل تاني؟ لانك مش بتعالج المشكلة.",583822,,AlexandriaEgy,,,483099,control,True
1,">بالنسبة لاهلنا في مصر وحبايبنا ادري اننا نمر بفترة فتنه لكن ما زال الود بيننا وحب، وان شاء الله تنقشع هذه الفتنه ونصبح احسن، وجميل برضه مشاركتك لوجهة نظرك عن اللي حاصل هناك.

ان شاء الله و ربي يحفظكم

>و صح عجبتني صورة سبايدرمان زرفتها

متغلاش عليك (انا سارقها)

الصورة الأخيرة دي ضحك خام",356060,,SaudiForSaudis,,,334960,control,True
13,عشان في الأول وفي الآخر هم أقلية والمجتمع المصري ازداد تشدد عن زمان فطبيعي يبقى في حساسية أكتر أكيد. ثم المسلمين حساسين أكتر من المسيحيين بمراحل. يعني انت عندك المحجبات في مصر (اللي هم أغلبية البنات المصرية) فاكرين انهم مضطهدين رغم انهم في بلد إسلامية. فتخيل بقى أقلية بحق وحقيقي بيتقال عليهم كفار وبيتشتموا ويتلعنوا يوميًا من الإسلاميين؟ طبيعي جدًا يبقى في حساسية خصوصًا إن الهزار في الدين غالباً بيبقى وراه إهانة أكتر من إنه هزار . عموماً ده رأيي (وانا مش مسيحية),171286,,ExEgypt,,1715380882.0,845689,anxiety,True
3,"كوني ما بدخن بالاردن شايفه  خخ
نسبة المدخنين عندنا فوق ال90% اعلى من اي بلد ثاني، ولما اخذنا عنها بالجامعه ما كان اي سبب مذكور ليش عندنا هل عالي فيعني ماحد عارف جواب انه ليش",301002,,jordan,,,376478,control,True
0,"اي مهاره قابله للاكتساب ودا حاجه اتعلمتها ومتاكد منها 
دايما الفنان الي بيشتغل ع نفسه وبيرسم كتير وبيعمل كد مش بدافع فطره او شغف فقط هيبق احسن من الي موهوب بالفطره وبس",475937,,EgyptArt,,,723909,control,True
5,يبني انت ظاخل علي كفار تقوللهم مستعر من اللغة,370114,,ExEgypt,,1709890995.0,404916,autism,True
1,وحوار  الدعاء ده يعني انت مستني اسرائيل تبطل تضرب فلسطين لمجرد ان اتنين مليار مسلم قاعدين ف المساجد بيدعوا ؟ خد بلاسباب,913571,,AlexandriaEgy,,,662910,control,True
105,هي بحيرة غامضة ومكتوبة بحيرة غامضة ودا سر محدش يعرفوا غير الناس كلها,586411,,Egypt,,,230944,control,True
-5,"شكلي محتاج اتعالج يا ريتني كنت اعرف اشوف النكت البضان زيك 

على الاقل بقيت بتخصي من نكت مسرح مصر لسه قدامي فتره",562040,,AlexandriaEgy,,,490903,control,True
1,كان سيتويشن شيب قديم يعم بس الموضوع بيعلق في دماغي كل فترة,360639,,AllHayganeen,,,822122,control,True
17,مليون خطوة في تلت شهور بقيت ساعات اتمشي بدل ما اركب لو حته قصيرة عشان اشوف حاجه مختلفة علي الاقل,215327,False,No_Zero_Days,انجاز الا ربع,1730031452.0,984841,adhd,True
1,بلدي طبعا وحتى الجسم يبقى بلدي كده كسم الحداثه احنا مش بنصور فيلم سكس,342792,,AllHayganeen,,,794899,control,True
2,"مش قصدي ياصحبي بس اقصد ان هما عايزين اتاسف وكدا بس العموم انا اعترفت بغلطي وحكيت ظروفي 
وسبت الشغل ومشيت شكرا ليك",690044,,AlexandriaEgy,,1721586198.0,499579,depression,True
0,"طول ١٧٦-١٧٧ سم يعتبر طويل بنسبه لكم ولا لا؟
وايه الفرق الى شيفينه مثالى بين الزوج زوجته بس مش عايز فرق بالارقام عايز اعرف هي توصل لكتفه للجزء التحتاني من وشه تحت كتفه كده",516254,False,AlexandriaEgy,عايز رأي البنات.,,474743,control,True
